body,title,url
"Unos aplausos rítmicos rompen el silencio y, luego, la voz inconfundible de Gilberto Santa Rosa se une a la introducción. “Si, si, do, re, si, do, re, mi, do, si, la, sol”, canta como dictando un secreto musical ‘El caballero de la salsa’ en Que se sepa, la tercera de las 19 canciones que componen su nuevo disco Colegas, un trabajo discográfico de siete años al que invitó a cantar a 16 de sus amigos y colegas más admirados.","Salsa entre colegas, el regalo musical de Gilberto Santa Rosa",https://www.eltiempo.com/cultura/musica-y-libros/gilberto-santa-rosa-habla-de-su-ultimo-disco-colegas-558335
"Juan Carlos Gálvez, de 27 años, el mayor de cuatro hermanos, apasionado por el ciclismo, técnico en gestión hotelera del Sena, decidió salir de su casa el pasado 30 de mayo, después de haber cumplido con juicio la cuarentena, para trabajar como domiciliario en un restaurante del sector de Ciudad Jardín Sur, en Antonio Nariño.",La historia del joven asesinado en su primer día como domiciliario,https://www.eltiempo.com/bogota/lo-asesinaron-en-su-primer-dia-de-trabajo-como-domiciliario-502512
nan,Lo que será noticia en 2021 en el mundo,https://www.eltiempo.com/mundo/mas-regiones/hechos-y-personajes-que-seran-noticia-en-2021-558279
"Colombia, al igual que una gran cantidad de países del mundo, está organizando los protocolos que usará para vacunar a la población contra el nuevo coronavirus.En los primeros meses de este 2021, según informó el propio Gobierno nacional, empezará el proceso. Los primeros en recibir la medicina serán mayores de 60 años, mayores de 16 con alguna de las nueve comorbilidades que se definieron (entre ellas hipertensión, diabetes y cáncer) y el personal de salud.(Le recomendamos: Así será el plan de vacunación contra el nuevo coronavirus en Colombia).",Colombianos conocerán su turno para vacunarse contra covid en una app,https://www.eltiempo.com/cultura/gente/coronavirus-colombia-colombianos-podran-verificar-turno-de-vacunacion-con-app-mi-vacuna-558329
"Por fin termina el año 2020. El año más devastador, más peligroso y más doloroso del presente siglo. Fue el año del maldito covid-19, un virus que apareció en diciembre del 2019 en Wuhan, una ciudad de la China. Y en enero del 2020 comenzó a regarse por todo el universo, hasta degenerar en una pandemia que ha contagiado a seres humanos de todas las edades y de todos los mundos. Además, ha llevado al sepulcro a millones de personas de todas las edades, en todos los países de todos los continentes. Ha sido el año de las clínicas, de los hospitales, de los centros de salud, de los cementerios. Fue el año de la ruina de grandes y pequeñas empresas, de grandes y pequeños negocios. De muchas industrias caseras, de pobres ventas callejeras.",nan,https://www.eltiempo.com/opinion/columnistas/lucy-nieto-de-samper/habra-esperanzas-columna-de-lucy-nieto-de-samper-558270
"Un impresionante gol, digno del fallecido astro argentino Diego Maradona, se vio en el partido que disputaron este sábado Crystal Palace y Sheffield United, en la Premier League de Inglaterra.",El golazo ‘maradoniano’ que le da la vuelta al mundo,https://www.eltiempo.com/deportes/futbol-internacional/premier-league-eze-de-crystal-palace-imito-a-maradona-y-anoto-un-golazo-558370
"Perfumada, impecablemente arreglada y con varios años de experiencia, la colombiana Maritza Claudia Fernanda Lorza Ramírez se movía como pez en el agua tanto en cárceles de Estados Unidos como de Colombia, buscando clientes.Incluso, a la atractiva abogada la precedía la fama de haber colaborado en casos exitosos con la DEA y de conocer muy bien el sistema americano.(Lo invitamos a leer: Los 25 capos que se colaron en las listas de las Farc) ",La mujer acusada de recibir US$ 1 millón por colar capos en las Farc,https://www.eltiempo.com/unidad-investigativa/asi-avanza-la-extradicion-de-la-abogada-maritza-lorza-558357
"Con una bola hecha de trapo, el entonces niño Jorge Bergoglio daba sus primeros toques al balón en una época en que los jóvenes debían recurrir a la inventiva para jugar al fútbol en la calle, recordó este sábado el ahora papa Francisco en una entrevista en la que calificó de ""poeta"" a Diego Maradona.","'En la cancha, Maradona era poeta': papa Francisco",https://www.eltiempo.com/deportes/futbol-internacional/papa-francisco-recuerda-cuando-conocio-maradona-al-que-llama-poeta-558305
"Riverside Consulting and Corporate Services es una empresa canadiense con 16 años de experiencia en materia de inmigración y educación hacia Canadá. Cuenta con soluciones en visados desarrolladas por consultores en inmigración y procesos migratorios bajo las diferentes categorías (Express Entry, Sponsor de Familiares, Negocios, Ofertas de Empleo por Nominación Provincial y Proyectos Especiales Federales o Provinciales). Asimismo y, teniendo en cuenta que estudiar representa una excelente oportunidad para obtener residencia permanente y permiso de trabajo durante todo el proceso, la compañía tiene importantes convenios con universidades canadienses.",¿Pensando en inmigrar a Canadá?,https://www.eltiempo.com/contenido-comercial/pensando-en-inmigrar-a-canada-555051
"El mensaje de Gayana Chuklansev, una enfermera de Los Ángeles, California (EE. UU.) se viralizó en TikTok.¿La razón? La mujer grabó, entre lágrimas, un video con el cual intenta persuadir a las personas a ""parar de ser descuidados (con el coronavirus)"".(Vea también: Colombia compra 9 millones de vacunas de Johnson & Johnson).",El crudo llamado de enfermera para no olvidar medidas de bioseguridad,https://www.eltiempo.com/mundo/eeuu-y-canada/coronavirus-en-ee-uu-se-hace-viral-en-tiktok-pedido-de-enfermera-gayana-chuklansev-en-california-558158
"Escribo esta columna sumido en una tristeza profunda. Roberto Junguito fue mi amigo durante cincuenta años. Un ser humano excepcional. Un magnífico economista. Un colombiano que le sirvió al país, que siempre creyó en su futuro, en su potencial y en el de sus gentes.",nan,https://www.eltiempo.com/opinion/columnistas/carlos-caballero-argaez/roberto-junguito-bonnet-columna-de-carlos-caballero-argaez-558268
"Partiendo de la base de que los siniestros viales se podrían evitar, las autoridades han sido enfáticas en recordar algunas recomendaciones que pueden prevenir estos hechos, sobre todo en épocas de alta movilidad como el comienzo de año.De acuerdo con Luis Lota, director de la Agencia Nacional de Seguridad Vial, es fundamental que quienes van a viajar en carro hagan una revisión mecánica y documental previa.",Claves para la prevención de accidentes en las vías,https://www.eltiempo.com/justicia/servicios/recomendaciones-para-evitar-accidentes-en-las-vias-558388
"Cuando se conoció la votación del Senado argentino con la que se aprobó la legalización del aborto, miles de mujeres con sus pañuelos verdes celebraron con emoción en la madrugada del miércoles en frente del Congreso en Buenos Aires. Allí habían permanecido por más de 12 horas para escuchar la noticia que se convirtió en un hito para América Latina y que reivindicaba años de lucha en favor de los derechos de las mujeres.(Lea aquí:  Claves para entender la ley del aborto aprobada en Argentina)",El hito que marcó Argentina con la legalización del aborto,https://www.eltiempo.com/mundo/latinoamerica/el-hito-que-marco-argentina-con-la-legalizacion-del-aborto-558368
"Las autoridades están a la espera de las pruebas que permitan establecer si un cuerpo hallado en el barrio San Bernardo, en el centro de Bogotá, corresponde al de Linda Michelle Amaya Buelvas, la menor de 15 años que desapareció el 30 de noviembre en el centro de la capital.Aunque su madre, Nathalie Amaya, estuvo el 31 de diciembre en Medicina Legal y aseguró que el cuerpo corresponde al de la menor, aún faltan procesos en Medicina Legal que indiquen, de manera definitiva, que se trata de Michelle. ",¿Qué pasó con Michelle Amaya? La menor de edad desaparecida en Bogotá,https://www.eltiempo.com/bogota/que-paso-con-michelle-amaya-la-menor-de-edad-desaparecida-en-bogota-558252
"En las últimas horas quedó demostrado que el barranquillero Álex Saab Morán no es un simple contratista del régimen de Nicolás Maduro. Su nombramiento como embajador permanente y plenipotenciario ante África –revelado por EL TIEMPO– confirmó la importancia que este tiene para Maduro, quien intenta desesperadamente otorgarle inmunidad ad portas de su extradición a Estados Unidos.(Lo invitamos a leer: Nicolás Maduro tiene todo listo para sacar a Álex Saab hacia Etiopía) ",El plan secreto de EE. UU. para que Álex Saab no se escape,https://www.eltiempo.com/unidad-investigativa/alex-saab-asi-es-el-plan-de-estados-unidos-para-que-no-se-escape-558354
"Un gran paso se dio en República Dominicana esta semana, donde la Cámara de Diputados aprobó el proyecto que prohíbe el matrimonio infantil en ese país, en el que se permitían las uniones de niñas a partir de los 15 años. ",Otro punto final para el matrimonio infantil / Una vuelta al mundo,https://www.eltiempo.com/mundo/mas-regiones/resumen-de-las-noticias-mas-importantes-de-la-primera-semana-del-2021-558364
nan,nan,https://www.futbolred.com/colombianos-en-el-exterior/solari-en-america-de-mexico-salidas-de-roger-martinez-y-andres-ibargueen-nicolas-benedetti-sigue-para-2021-ultimas-noticias-hoy-129479
nan,Avión de Avianca: la verdad que aún no aparece,https://www.eltiempo.com/justicia/conflicto-y-narcotrafico/31-anos-del-atentado-del-avion-de-avianca-437606
nan,nan,https://www.eltiempo.com/opinion/caricaturas/matador/ano-nuevo-vida-nueva-caricatura-de-matador-558390
"El sexo forma parte normal de la vida y es tan importante como cualquier función en el organismo, de ahí que en estos momentos de propósitos vale la pena echar una mirada sincera a este aspecto y procurar sacarle el mayor provecho, para lo cual no necesita hacer público nada, simplemente actuar.Aunque suena simple, hay que empezar por derribar tanta mojigatería que se enreda a los temas del catre y convencerse de que la planta baja no está ligada con el pecado, lo inmoral o lo sucio y que no se puede ceder la autonomía en las decisiones de este tipo por tontas que parezcan. Así de sencillo.","Año nuevo, polvos renovados / Sexo con Esther",https://www.eltiempo.com/salud/ano-nuevo-polvos-renovados-columna-de-esther-balac-558421
"“La verdad, nunca me imaginé adentrarme en esa inmensa caverna y luego, en completo silencio, comenzar a encontrar espacios tan místicos, tan espirituales”, “No lo podía creer, estaba 180 metros bajo tierra, al comienzo me dio algo de nervios pero luego me relajé y disfruté mucho del recorrido”, “Salí muy relajada de este lugar, realmente vale la pena visitarlo”, estos son solo algunos comentarios de turistas que han visitado la Catedral de Sal de Zipaquirá, sin mencionar los medios internacionales que han hecho reseñas de lugar y atraído a cientos de ciudadanos del mundo cada año.",Catedral de Sal de Zipaquirá: 25 años deleitando turistas,https://www.eltiempo.com/bogota/catedral-de-sal-25-anos-de-historia-558372
"No obstante la esperanza que generan las vacunas, sin duda la pandemia marcará la agenda del 2021. Con 84 millones de casos en el mundo y más de 1,8 millones de muertes, siguen las preocupaciones.Lo cierto es que aunque ya se tienen algunas herramientas para la contención, como las medidas de bioseguridad, el desarrollo acelerado de biológicos para prevenir la transmisión e, incluso, las señales que dan algunos medicamentos para tratar la infección, la dinámica del nuevo coronavirus en el año que comienza continúa siendo un misterio. Y todo porque el acontecer del virus depende de muchísimos factores.",nan,https://www.eltiempo.com/opinion/editorial/ano-de-vacuna-y-cooperacion-editorial-de-el-tiempo-del-3-de-enero-de-2021-558385
"Este sábado, la Fundación GAAT (Grupo de Acción y Apoyo Trans) informó en sus redes sociales que la activista y defensora de derechos humanos Laura Weinstein, su directora, murió. ""Gracias por cada momento que nos permitiste construir en colectivo, por tus enseñanzas y por todo tu apoyo incondicional"", escribieron.Weinstein fue una de las personas que más trabajó por el reconocimiento de las identidades trans en Colombia. Lo hizo principalmente desde esa organización, a la que llegó en 2009 y desde la cual lideró iniciativas legislativas e institucionales a favor de los derechos de las personas trans, como el voto trans, la política pública LGBTI, el apoyo a la infancia trans, el rechazo a los transfeminicidios, entre otras.","Murió la activista Laura Weinstein, defensora de la población trans",https://www.eltiempo.com/vida/murio-laura-weinstein-activista-y-mujer-trans-colombiana-558344
"Fabio Estrada Paños Ingleses es una empresa dedicada a la importación y venta de paños ingleses de las más afamadas marcas Scabal y Bower Roebuck. Dentro de su amplio portafolio, podrá encontrar una gran variedad de paños y productos para que confeccione su traje a la medida.Ingrese a https://fabioestradapanosingleses.com/ y adquiera los paños o comuníquese a través de https://wa.link/7goajs para más información o al teléfono 310 320 8073.Recuerde que Fabio Estrada Paños Ingleses está ubicado en la calle 142 No. 20-08 en la ciudad de Bogotá y en Instagram o Facebook como @fabioestradapanosingleses","Fabio Estrada Paños Ingleses, tradición y calidad",https://www.eltiempo.com/contenido-comercial/fabio-estrada-panos-ingleses-tradicion-y-calidad-549559
"No fue un año fácil para gobernar. La alcaldesa de Bogotá, Claudia López, no solo tuvo que hacerle frente a una pandemia que generó desempleo, pobreza y graves retrasos en la ciudad, sino, a la par, recibir toda clase de críticas a través de las redes sociales.Pese a esto, expertos de diferentes ámbitos de la vida pública analizaron cuáles fueron los aciertos de la mandataria y cuáles deberían ser sus prioridades en 2021. La mayoría de ellos centraron sus análisis en el manejo de la pandemia, es obvio.",La mirada de los expertos al primer año de gobierno de Claudia López,https://www.eltiempo.com/bogota/balance-de-primer-ano-de-gobierno-de-claudia-lopez-558367
"Cuando Paola Betancourt estuvo viajando durante un mes por España con una pequeña mochila, se dio cuenta que no necesitaba muchas cosas para vivir.","""Un año sin hacer compras"", el desafío que pone a prueba tu consumismo",https://www.eltiempo.com/economia/finanzas-personales/un-ano-sin-hacer-compras-el-desafio-que-pone-a-prueba-tu-consumismo-558175
" El fin de año es la oportunidad perfecta para cambiar de ‘look’ y sorprender a sus familiares mientras celebra en casa o a través de videollamadas. Además de los vestuarios nuevos, otra alternativa para lograrlo son los peinados.Eso lo saben los ‘influenciadores’, quienes, ni cortos ni perezosos, han publicado tutoriales fáciles de seguir y acordes con el espíritu festivo que suele acompañar esta época decembrina.",Opciones de peinados fáciles de hacer para despedir el 2020,https://www.eltiempo.com/cultura/gente/navidad-2020-peinados-faciles-recomendados-para-despedir-el-ano-2020-556932
nan,Conozca la nueva Renault Koleos,https://www.eltiempo.com/contenido-comercial/conozca-la-nueva-renault-koleos-556176
"Sin duda las fotografías tomadas desde el espacio son unas de las imágenes que vale la pena mirar una y otra vez, no solo por su calidad sino también porque retratan aspectos poco conocidos de nuestro planeta.",Las mejores imágenes de la Tierra captadas desde el espacio en 2020,https://www.eltiempo.com/cultura/gente/la-nasa-compartio-las-mejores-imagenes-de-la-tierra-durante-el-2020-vealas-aqui-558253
"Dairo Antonio Úsuga David, de 49 años, es el narcotraficante más buscado en el país. De hecho, las autoridades colombianas ofrecen una recompensa de 3 mil millones de pesos por información que facilite su ubicación y captura. Estados Unidos ofrece por Úsuga David, más conocido con el alias de Otoniel, la suma de 5 millones de dólares. El hombre es considerado el jefe de la organización dedicada al tráfico de cocaína 'Clan del Golfo'.","'Otoniel', el narco por quien ofrecen US$ 5 millones, huye enfermo",https://www.eltiempo.com/justicia/conflicto-y-narcotrafico/como-vive-otoniel-jefe-del-clan-del-golfo-el-narcotraficante-mas-buscado-en-colombia-558244
nan,"Fetuccini a la carbonara, un viaje por los sabores de Italia",https://www.eltiempo.com/cultura/gastronomia/receta-para-preparar-fetuccini-a-la-carbonara-558231
"La alcaldesa Claudia López se tomará unos días de descanso. Específicamente, la mandataria de Bogotá estará fuera del cargo hasta el 11 de enero. Hasta entonces, el Secretario Distrital de Gobierno, Luis Ernesto Gómez, estará al frente de las decisiones capitalinas como alcalde encargado. ",Críticas a la alcaldesa Claudia López por haber salido de vacaciones,https://www.eltiempo.com/bogota/claudia-lopez-y-angelica-lozano-la-foto-que-ha-generado-varias-reacciones-en-twitter-558301
"Un hombre que llegó al país el 12 de diciembre proveniente de Reino Unido y que dio positivo para covid-19 prendió las alarmas de las autoridades de salud porque podría tratarse de un caso de la nueva variante del virus.Pero desde el Instituto Nacional de Salud aclararon que el hombre se contagió en Colombia, por lo que se descarta que la nueva variante del covid-19 esté en territorio nacional.  (Además: Reportero informa en vivo sobre muerte por covid de la mamá de su hijo)",Descartan circulación de nueva variante del covid-19 en Cúcuta,https://www.eltiempo.com/colombia/otras-ciudades/coronavirus-en-colombia-investigan-presunto-caso-de-nueva-cepa-en-el-pais-558323
nan,La ciencia de comunicar ciencia y tecnología,https://www.eltiempo.com/contenido-comercial/la-ciencia-de-comunicar-ciencia-y-tecnologia-554193
"Esta es la pequeña historia de un hallazgo: caballos modernos, perros de guerra, escenas de aperreamiento, vacunos y una espada en el arte rupestre de la serranía de La Lindosa. Así podrá ver las Cuadrántidas, la primera lluvia de estrellas de 2021En diciembre de 2011 se publicó el libro, con profusión de ilustraciones, titulado 'La joven Constitución de Colombia'. Sus editores fueron los escritores Enrique Santos Molano y Carlos Nicolás Hernández Camacho.","‘No es un perezoso gigante, es un chigüiro’",https://www.eltiempo.com/vida/ciencia/pinturas-rupestres-de-la-serrania-de-la-lindosa-no-es-un-perezoso-gigante-es-un-chigueiro-558374
nan,nan,https://www.futbolred.com/futbol-colombiano/liga-betplay/miguel-angel-borja-junior-confirmo-la-continuidad-del-delantero-en-el-equipo-129481
"¿Quiere disfrutar de un ambiente diferente en un entorno natural con todos los protocolos de bioseguridad? A tan solo cinco minutos de Villavicencio y en el kilómetro 8 vía Catama - Caños Negros, se encuentra el Parque Acuático Karmanu, un lugar donde encontrará piscinas, toboganes, juegos, canchas y más para divertirse en familia. Si desea más información y/o visitarlos puede comunicarse al 350 348 80 61.",Bienvenido al Parque Acuático Karmanu,https://www.eltiempo.com/contenido-comercial/bienvenido-al-parque-acuatico-karmanu-557720
"Se hace llamar así: Ángela. Se resiste a aceptar que la cobija la sombra de otro nombre. Se llama Ángela, pero también se llama Miguel Ángel. Así la saluda un señor cuando pasa a su lado con un vestido enterizo negro y corto, con unas piernas delgadas y largas, lampiñas y bronceadas. Lleva unas medias blancas de colegiala que le llegan a las rodillas y unas sandalias negras de cuero; el pelo, bien cuidado, lo luce largo y entrecano, con visos dorados de tintura, y le llega debajo de los hombros. Una cinta rosada, con un moño en forma de flor, adorna su cabeza.  (Lea también: El drama de las mujeres migrantes y de la población LGBTI en Colombia).",El vendedor de lotería que se volvió mujer a los 60 años,https://www.eltiempo.com/colombia/otras-ciudades/el-vendedor-de-loteria-que-se-volvio-mujer-a-los-60-anos-en-el-libano-tolima-558340
"El Feng Shui es descrito por ‘National Geographic’ como un arte ancestral basado en principios de la metafísica china. Su objetivo principal es proporcionar armonía a la relación de las personas con su entorno. ‘El libro de los sepulcros’, de Guo Pu, es la primera publicación en la que se mencionó el Feng Shui. Fue escrito aproximadamente en el año 400 a.C. y explicaba algunas de las estrategias para equilibrar la energía en diferentes espacios. Despídase de las energías negativas y dele la bienvenida al 2021 con estas técnicas del Feng Shui publicadas en las revistas ‘Forbes’ y ‘Reader’s Digest’(Además: Los agüeros más comunes de los colombianos para Año Nuevo).",10 consejos Feng Shui para recibir el Año Nuevo con buena energía,https://www.eltiempo.com/cultura/gente/10-consejos-feng-shui-para-recibir-el-ano-nuevo-con-buena-energia-558082
Responsabilidad de los empresarios y disciplina de la ciudadanía son las claves para que las compras y las reuniones de fin de año no disparen los contagios de covid en el país.,¿En qué va la reactivación económica del país? Habla Mincomercio,https://www.eltiempo.com/politica/gobierno/como-va-la-recuperacion-economica-555564
"El Tiempo Play, la nueva plataforma de audio y vídeo (VOD) de Casa Editorial El Tiempo, ofrece un espacio de entretenimiento a través de su destacada selección de películas agrupadas en cerca de 23 categorías y diferentes géneros como 'cine colombiano', 'romance', 'terror para no dormir', 'Festival de Cannes', y 'la familia en el cine' entre otros.",Descubra lo mejor del cine independiente en el Tiempo Play,https://www.eltiempo.com/mas-contenido/descubra-lo-mejor-del-cine-independiente-en-el-tiempo-play-548752
"Una vez más las expectativas están puestas en lo que suceda un 5 de enero en Venezuela. En este 2021, por el inicio de una nueva legislatura –la quinta desde que fue creada la Asamblea Nacional (AN) de este país, en 1999–, con una importante mayoría oficialista (256 de 277 diputados).",El chavismo y la oposición tienen la mirada fija en el 5 de enero,https://www.eltiempo.com/mundo/venezuela/analisis-que-viene-para-el-chavismo-con-la-nueva-asamblea-558363
"Disney Plus, que llegó a Colombia el pasado 17 de noviembre, ha tenido un maravilloso impacto representado en millones de descargas alrededor del mundo. Actualmente cuenta con películas y cortos de Pixar, filmes y series de Marvel, todas las animaciones clásicas y live-actions de Disney, Star Wars y National Geographic.En el mes de diciembre la plataforma de streaming en Latinoamérica llegó cargada de varios estrenos exitosos, entre los que figuraron ‘Soul’, ‘Mulán’, ‘The Mandalorian’ y otros. (Lea también: Hablamos con los protagonistas de la nueva película de Pixar).",Estos son los estrenos de Disney Plus para enero del 2021,https://www.eltiempo.com/cultura/gente/disney-plus-estrenos-para-enero-2021-557467
"Terminando el 2020, la Empresa Metro y la entidad responsable de formular el nuevo POT vieron renunciar a sus cabezas. ¿Qué retos asumirán los nuevos fichajes?",Metro y Secretaría de Planeación afrontarán el 2021 con nuevos líderes,https://www.eltiempo.com/bogota/que-necesitan-el-nuevo-gerente-del-metro-de-bogota-y-la-nueva-secretaria-de-planeacion-558381
"A principios de marzo del 2020, Colombia registró su primer caso de contagio de coronavirus.Desde ese momento hasta el 1 de enero del 2021, el país acumula más de 1,6 millones de infecciones y más de 43.000 fallecidos.En los últimos 10 meses, varias han sido las medidas que se han adoptado para evitar la propagación del virus y así bajar las afectaciones.(Lea también: Indignante caso de abandono de un niño, de 3 años, y su perro).",El enfermero que hace 10 meses no va a su casa por cuidar abuelitos,https://www.eltiempo.com/cultura/gente/bogota-la-historia-del-enfermero-que-no-ve-a-su-familia-hace-10-meses-por-cuidar-abuelitos-558269
"En el 2003, el Libro de los Récord Guinness reconoció al ruso Dzhambulat Khatokhov, quien ese entonces tenía 4 años, como el ‘niño con más peso del mundo’.Durante su niñez y pubertad, sus cifras fueron impresionantes, aunque también alarmantes (por su salud): a los 2 años pesaba 34 kilogramos (kg); a los 7, 101 kg; y a los 13, 180 kg, según medios de Rusia.¡Es que a los 7 pesaba lo mismo que un elefante bebé!(Le recomendamos: Indignante caso de abandono de un niño, de 3 años, y su perro).",Con tan solo 21 años murió el ‘niño con más peso del mundo’,https://www.eltiempo.com/cultura/gente/record-guinness-joven-que-obtuvo-record-al-nino-con-mas-peso-del-mundo-murio-a-los-21-anos-558232
"En los últimos 4 años, la Procuraduría General de la Nación ha sancionado a 1.221 funcionarios de elección popular, entre esos ha habido 592 alcaldes y 14 gobernadores con destitución e inhabilidad general. Y tan solo desde julio de 2020 hasta el 28 de diciembre pasado, 52 funcionarios que fueron elegidos por voto han sido destituidos e inhabilitados por el órgano de control.",El revolcón en las sanciones a funcionarios elegidos por voto,https://www.eltiempo.com/justicia/investigacion/proyecto-de-ley-de-la-procuraduria-sobre-sanciones-contra-funcionarios-elegidos-por-voto-558401
